{
  "id": "ce95115b-32da-4aa9-9284-84e2f6884c87",
  "version": 1,
  "status": "live",
  "deckOrder": 5,
  "public": {
    "yearPublic": 2023,
    "sectorPublic": "소비재",
    "sizeBucket": "대형",
    "horizonDays": 365,
    "difficulty": 1,
    "panels": {
      "flow": {
        "index14": [100, 101, 103, 102, 105, 107, 106, 109, 112, 110, 114, 116, 118, 121],
        "market14": [100, 102, 103, 105, 106, 108, 107, 110, 112, 113, 115, 116, 118, 119],
        "volumeTrend": "유지",
        "windowDays": 180
      },
      "numbers": {
        "growth": {"revYoy": "+6%", "opm": "18% → 18%", "epsYoy": "+7%", "guidance": "유지"},
        "valuation": {"per": "24", "perSector": "21", "pbr": "5.2", "psr": "3.1"},
        "health": {"debtRatio": "35%", "netCash": "보유", "fcf": "양수"},
        "asOfRelative": "판단일 D-45(공시 기준)"
      },
      "then": {
        "rate": "4.75~5.00%",
        "rateTrend": "상승기",
        "fxNote": null,
        "commodityNote": null,
        "notes": [
          {
            "when": "판단일 D-45",
            "text": "이 회사는 직전 분기 실적 발표에서 올해도 지난해와 비슷한 속도로 성장하겠다는 전망을 내놓았어요.",
            "sourceKind": "공시"
          },
          {"when": "판단일 D-21", "text": "한 지역 은행이 파산하면서 금융 불안이 커졌어요.", "sourceKind": "보도"},
          {"when": "판단일 D-17", "text": "소비자물가 상승률이 여덟 달째 낮아졌어요.", "sourceKind": "통계"},
          {"when": "판단일 D-14", "text": "경기 둔화 우려 속에 필수소비재가 방어 업종으로 자주 언급됐어요.", "sourceKind": "보도"},
          {"when": "판단일 D-9", "text": "기준금리가 0.25%p 올라 4.75~5.00%가 됐어요.", "sourceKind": "통계"}
        ]
      }
    },
    "evidenceOptions": [
      {
        "id": "ev1",
        "label": "매출 +6%",
        "why": "매출 성장 속도는 이 회사에 기대할 수 있는 이익 증가의 출발점이에요.",
        "panel": "numbers"
      },
      {
        "id": "ev2",
        "label": "PER 24 vs 21",
        "why": "업종 중앙값과의 차이는 안정성에 붙은 값이 얼마인지 보여 줘요.",
        "panel": "numbers"
      },
      {
        "id": "ev3",
        "label": "영업이익률 유지",
        "why": "이익률이 유지되면 원가가 올라도 값을 올릴 힘이 있다는 신호일 수 있어요.",
        "panel": "numbers"
      },
      {
        "id": "ev4",
        "label": "순현금 보유",
        "why": "현금이 넉넉하면 불안한 시기에도 배당과 투자를 이어 가기 쉬워요.",
        "panel": "numbers"
      },
      {
        "id": "ev5",
        "label": "방어 업종 선호",
        "why": "시장이 불안할 때 어떤 업종에 돈이 몰리는지는 그때의 분위기를 보여 줘요.",
        "panel": "then"
      },
      {
        "id": "ev6",
        "label": "6개월 +21%, 시장 +19%",
        "why": "판단일까지 시장과 비슷하게 움직였는지는 이 회사만의 이야기가 있었는지 보여 줘요.",
        "panel": "flow"
      }
    ],
    "riskOptions": [
      {"id": "rk1", "label": "성장 정체"},
      {"id": "rk2", "label": "밸류에이션 프리미엄"},
      {"id": "rk3", "label": "소비 둔화"}
    ]
  },
  "reveal": {
    "outcome": {
      "companyName": "코카콜라",
      "ticker": "KO",
      "period": "2023 Q1 → 2024 Q1",
      "startDate": "2023-03-31",
      "endDate": "2024-03-28",
      "returnPct": 2.1,
      "benchReturnPct": 26.5,
      "benchName": "S&P 500",
      "pricePath": [100, 101, 100, 102, 99, 98, 97, 99, 98, 100, 99, 101, 102, 102.1],
      "benchPath": [100, 103, 105, 108, 110, 112, 111, 114, 117, 119, 121, 124, 125, 126.5],
      "sources": [
        {"kind": "예시", "label": "예시 자료(실측 아님) — 수치·날짜·문장은 설명용으로 만든 값이에요", "url": null},
        {
          "kind": "가격",
          "label": "파생 지수 14점(판단일 = 100) · 총수익 기준(배당 재투자·분할 반영, 이 기간 분기 배당 4회 포함, 분할 없음) · 예시 값",
          "url": null
        },
        {"kind": "공시", "label": "직전 분기 실적 발표 자료(예시)", "url": null},
        {"kind": "통계", "label": "미국 기준금리 결정·소비자물가 발표(예시)", "url": null},
        {"kind": "보도", "label": "당시 금융 불안·업종 관련 보도(예시)", "url": null}
      ]
    },
    "keyPoints": [
      "1년 동안 시장이 크게 오른 구간이라 안정적인 방어주는 상대적으로 뒤처졌어요.",
      "업종보다 높은 PER에 비해 성장은 한 자릿수에 머물렀어요.",
      "주가는 거의 제자리였고, 배당을 더해도 시장 상승을 따라가지 못했어요."
    ],
    "learningPoints": [
      {
        "conceptId": "base-rate",
        "rank": 1,
        "linkSentence": "시장이 26.5% 오른 1년이라, 이 카드의 결과는 회사보다 시장 흐름이 크게 좌우했어요."
      },
      {
        "conceptId": "abs-vs-relative",
        "rank": 2,
        "linkSentence": "주가는 2.1% 올라 절대수익은 플러스였지만, 시장 대비로는 24.4%p 뒤졌어요."
      }
    ]
  },
  "internal": {
    "notes": "예시 자료(실측 아님). 프로토타입 data.js의 c003를 옮겼다. 수치·「그때」 문장은 설명용 예시라 실제 주가·재무와 다를 수 있다(금리 값과 날짜만 당시 공개 자료에 가깝게 고쳤다). 실제 카드로 바꿀 때 공시 원문·공개 통계로 다시 만들고 flow_index.py·outcome.py로 다시 계산한다.",
    "leakTerms": [
      "코카콜라",
      "Coca-Cola",
      "Coca Cola",
      "KO",
      "코크",
      "Coke",
      "스프라이트",
      "Sprite",
      "환타",
      "Fanta"
    ],
    "dataCutoff": "2023-03-31",
    "example": true
  }
}
